{
  "$schema": "https://json-schema.org/draft/2020-12/schema",
  "title": "UtauTTS renderer manifest",
  "type": "object",
  "additionalProperties": false,
  "required": ["manifest_version", "kind", "id", "display_name", "contract", "provider", "provider_version"],
  "properties": {
    "$schema": {"type": "string"},
    "manifest_version": {"const": 2},
    "kind": {"const": "synthesis-engine"},
    "id": {"type": "string", "pattern": "^[a-z0-9][a-z0-9._-]{0,95}$"},
    "display_name": {"type": "string", "minLength": 1},
    "description": {"type": "string"},
    "contract": {"enum": ["unit-renderer", "neural-synthesizer"]},
    "contract_version": {"type": "integer", "minimum": 1},
    "provider": {"type": "string", "minLength": 1},
    "provider_version": {"type": "string", "minLength": 1},
    "protocol": {"const": "utautts-provider"},
    "protocol_version": {"type": "integer", "minimum": 1},
    "provider_args": {
      "type": "array",
      "items": {"type": "string", "minLength": 1}
    },
    "experimental": {"type": "boolean"},
    "acceleration": {"enum": ["cpu"]},
    "default_priority": {"type": "integer"},
    "update_managed": {"type": "boolean"},
    "capabilities": {
      "type": "object",
      "additionalProperties": false,
      "properties": {
        "frame_pitch": {"type": "boolean"},
        "boundary_bridge": {"type": "boolean"},
        "internal_timing": {"type": "boolean"},
        "speech_prosody_experiment": {"type": "boolean"}
      }
    },
    "resources": {
      "type": "object",
      "additionalProperties": {
        "type": "object",
        "additionalProperties": false,
        "required": ["path"],
        "properties": {
          "path": {"type": "string", "minLength": 1},
          "required": {"type": "boolean"},
          "executable": {"type": "boolean"}
        }
      }
    },
    "platforms": {
      "type": "array",
      "items": {"type": "string", "pattern": "^(any|[a-z0-9]+-[a-z0-9]+)$"},
      "uniqueItems": true
    },
    "platform_resources": {
      "type": "object",
      "propertyNames": {"pattern": "^(any|[a-z0-9]+-[a-z0-9]+)$"},
      "additionalProperties": {
        "type": "object",
        "additionalProperties": {
          "type": "object",
          "additionalProperties": false,
          "required": ["path"],
          "properties": {
            "path": {"type": "string", "minLength": 1},
            "required": {"type": "boolean"},
            "executable": {"type": "boolean"}
          }
        }
      }
    },
    "settings": {
      "type": "array",
      "items": {
        "type": "object",
        "additionalProperties": false,
        "required": ["id", "type"],
        "properties": {
          "id": {"type": "string", "pattern": "^[a-z0-9][a-z0-9_]*$"},
          "type": {"enum": ["integer", "number", "boolean", "enum", "string"]},
          "group": {"type": "string"},
          "default": {},
          "min": {"type": "number"},
          "max": {"type": "number"},
          "step": {"type": "number"},
          "label": {"type": "string"},
          "options": {
            "type": "array",
            "items": {
              "type": "object",
              "additionalProperties": false,
              "required": ["value"],
              "properties": {
                "value": {"type": "string"},
                "label": {"type": "string"}
              }
            }
          }
        }
      }
    }
  },
  "allOf": [
    {
      "if": {
        "properties": {
          "manifest_version": {"const": 2},
          "protocol": {"const": "utautts-provider"}
        },
        "required": ["manifest_version", "protocol"]
      },
      "then": {
        "required": ["contract_version", "protocol_version"],
        "properties": {"contract": {"const": "unit-renderer"}}
      }
    }
  ]
}
