{
  "manifest_version": 2,
  "kind": "synthesis-engine",
  "id": "waveform",
  "display_name": "Waveform",
  "description": "UtauTTS native waveform renderer",
  "contract": "unit-renderer",
  "provider": "waveform",
  "provider_version": "1",
  "update_managed": true,
  "acceleration": "cpu",
  "default_priority": 100,
  "capabilities": { "frame_pitch": true, "boundary_bridge": true },
  "settings": [
    { "id": "mora_duration_ms", "type": "integer", "group": "timing", "default": 120, "min": 20, "max": 1000, "label": "settings.defaultMoraDuration" },
    { "id": "pause_duration_ms", "type": "integer", "group": "timing", "default": 180, "min": 0, "max": 3000, "label": "settings.defaultPauseDuration" },
    { "id": "leading_preutterance_ms", "type": "integer", "group": "timing", "default": 0, "min": 0, "max": 300, "label": "settings.defaultLeadingPreutterance" },
    { "id": "intonation_strength", "type": "number", "group": "prosody", "default": 2.0, "min": 0, "max": 4, "step": 0.01, "label": "settings.defaultIntonation" },
    { "id": "boundary_tone", "type": "boolean", "group": "correction", "default": true, "label": "settings.boundaryTone" },
    { "id": "stretch_adapt", "type": "boolean", "group": "correction", "default": true, "label": "settings.stretchAdapt" },
    { "id": "pause_context", "type": "boolean", "group": "correction", "default": true, "label": "settings.pauseContext" },
    { "id": "english_weak_form", "type": "boolean", "group": "pronunciation", "default": true, "label": "settings.englishWeakForm" }
  ]
}
